{
  "snapshot_schema_version": "backlog-promoter-snapshot.v0",
  "controller": "backlog_promoter",
  "captured_at_utc": "2026-07-15T03:00:00+00:00",
  "captured_at_jst": "2026-07-15T12:00:00+09:00",
  "now_jst": "2026-07-15T12:00:00+09:00",
  "limits": {
    "max_issues": 200,
    "max_bytes": 2000000,
    "issues_truncated": false,
    "bytes_truncated": false,
    "truncation_reason": null
  },
  "managed_projects": [
    {
      "project_key": "agentmesh",
      "multica_project_id": "00000000-0000-4000-8000-000000000001",
      "project_name": "AgentMesh",
      "status": "active",
      "workspace_path": "C:/Users/Keisu/Projects/OSS/agentmesh-private",
      "priority": "P0",
      "lead": "ai",
      "notes": "sanitized fixture"
    }
  ],
  "schedule_inventory": [],
  "issues": [
    {
      "id": "iss_snap_1",
      "identifier": "AM-201",
      "project_key": "agentmesh",
      "title": "Snapshot eligible backlog item",
      "status": "backlog",
      "assignee_type": "agent",
      "created_at": "2026-07-10T00:00:00+09:00",
      "metadata": {
        "work_owner": "ai",
        "project_key": "agentmesh"
      }
    },
    {
      "id": "iss_snap_human",
      "identifier": "AM-202",
      "project_key": "agentmesh",
      "title": "Human owned backlog item",
      "status": "backlog",
      "assignee_type": "member",
      "created_at": "2026-07-10T00:00:00+09:00",
      "metadata": {
        "work_owner": "human",
        "project_key": "agentmesh"
      }
    },
    {
      "id": "iss_snap_todo",
      "identifier": "AM-203",
      "project_key": "agentmesh",
      "title": "Already todo",
      "status": "todo",
      "assignee_type": "agent",
      "created_at": "2026-07-10T00:00:00+09:00",
      "metadata": {
        "work_owner": "ai",
        "project_key": "agentmesh"
      }
    }
  ],
  "dependency_status_by_id": {},
  "issue_run_presence": {
    "AM-201": {
      "has_active_or_queued_run": false,
      "latest_run_status": null,
      "active_run_count": 0,
      "queued_run_count": 0
    }
  },
  "evidence_preflight_by_issue_id": {
    "iss_snap_1": {
      "ok": true,
      "reason_code": "no_repo_references"
    },
    "iss_snap_human": {
      "ok": true,
      "reason_code": "no_repo_references"
    }
  },
  "scan_metrics": {
    "issues_scanned": 3,
    "metadata_items_inspected": 3,
    "pages_fetched": 1,
    "statuses_scanned": ["todo", "in_progress", "in_review", "blocked", "backlog"],
    "early_stop_reason": null,
    "total_reported": 3
  },
  "warnings": [],
  "error": null
}
